{
  "phase": "P0",
  "date": "2026-01-24",
  "doc": "docs/02_ARCHITECTURE/ARC-123.md",
  "completed": [
    "Ran MCP preflight for Step Functions and KMS",
    "Classified claims and set Canada-first scope"
  ],
  "blockers": [],
  "acceptance_checklist": [
    "Preflight MCP calls logged",
    "Scope and claims classified"
  ],
  "mcp_evidence_ids": [
    "MCP-20260124-0001",
    "MCP-20260124-0002"
  ],
  "pillar_matrix_deltas": [
    "Initial pillars populated"
  ]
}
